{
  "alignments": [],
  "alternate_rendering_ids": [],
  "audit_ids": [],
  "audit_records": [],
  "canonical_rendering_ids": [],
  "concept_ids": [
    "cpt.ps119.v091.a.0001"
  ],
  "current_layer_state": {
    "latest_layer": "source",
    "locked_layers": []
  },
  "issue_links": [],
  "pr_links": [],
  "psalm_id": "ps119",
  "ref": "Psalm 119:91",
  "renderings": [],
  "review_decisions": [],
  "segmentation_type": "verse",
  "source_hebrew": "לְֽ֭מִשְׁפָּטֶיךָ עָמְד֣וּ הַיּ֑וֹם כִּ֖י הַכֹּ֣ל עֲבָדֶֽיךָ׃",
  "source_transliteration": "lə ʿāməḏû hayyôm kiy hakōl",
  "status": "draft",
  "token_ids": [
    "ps119.v091.t001",
    "ps119.v091.t002",
    "ps119.v091.t003",
    "ps119.v091.t004",
    "ps119.v091.t005",
    "ps119.v091.t006"
  ],
  "tokens": [
    {
      "compiler_features": {
        "component_count": 3,
        "conjunction_role": null,
        "construct_state": true,
        "discourse_marker": null,
        "divine_name": false,
        "english_parts": [
          "by",
          "ordinances",
          "your"
        ],
        "gloss_fragments": [
          "for",
          "judgments",
          "your"
        ],
        "preposition_role": "by",
        "raw_classes": [
          "prep",
          "noun",
          "pron"
        ],
        "raw_pos": [
          "preposition",
          "noun",
          "suffix"
        ],
        "suffix_pronoun": {
          "gender": "masculine",
          "number": "singular",
          "person": "second",
          "text": "your"
        },
        "temporal_pair_candidate": false
      },
      "corpus_occurrence_refs": [
        "Psalm 1:2",
        "Psalm 1:3",
        "Psalm 1:4",
        "Psalm 2:2",
        "Psalm 2:3",
        "Psalm 2:4",
        "Psalm 2:5",
        "Psalm 2:6",
        "Psalm 2:7",
        "Psalm 2:8",
        "Psalm 2:9",
        "Psalm 2:12",
        "Psalm 3:1",
        "Psalm 3:2",
        "Psalm 3:3",
        "Psalm 3:4",
        "Psalm 3:5",
        "Psalm 3:6",
        "Psalm 3:7",
        "Psalm 3:8",
        "Psalm 3:9",
        "Psalm 4:2",
        "Psalm 4:3",
        "Psalm 4:4"
      ],
      "display_gloss": "for your judgments",
      "enrichment_sources": {
        "macula": {
          "available_fields": [
            "word_sense"
          ],
          "missing_fields": [
            "syntax_role",
            "semantic_role",
            "referent"
          ],
          "status": "partial"
        },
        "oshb": {
          "available_fields": [
            "lemma",
            "strong",
            "morph_code",
            "morph_readable",
            "part_of_speech"
          ],
          "missing_fields": [
            "stem"
          ],
          "status": "partial"
        }
      },
      "gloss_parts": [
        "for",
        "judgments",
        "your"
      ],
      "greek": "τῇ διατάχει σου",
      "greek_strong": "4675",
      "lemma": "הוּא",
      "missing_enrichments": [
        "oshb:stem",
        "macula:syntax_role",
        "macula:semantic_role",
        "macula:referent"
      ],
      "morph_code": "R/Ncmpc/Sp2ms",
      "morph_readable": "R/Ncmpc/Sp2ms",
      "normalized": "למשפטיך",
      "occurrence_index": 3930,
      "part_of_speech": "suffix",
      "psalms_occurrence_refs": [
        "Psalm 1:2",
        "Psalm 1:3",
        "Psalm 1:4",
        "Psalm 2:2",
        "Psalm 2:3",
        "Psalm 2:4",
        "Psalm 2:5",
        "Psalm 2:6",
        "Psalm 2:7",
        "Psalm 2:8",
        "Psalm 2:9",
        "Psalm 2:12",
        "Psalm 3:1",
        "Psalm 3:2",
        "Psalm 3:3",
        "Psalm 3:4",
        "Psalm 3:5",
        "Psalm 3:6",
        "Psalm 3:7",
        "Psalm 3:8",
        "Psalm 3:9",
        "Psalm 4:2",
        "Psalm 4:3",
        "Psalm 4:4"
      ],
      "ref": "Psalm 119:91#1",
      "referent": null,
      "same_psalm_occurrence_refs": [
        "Psalm 119:2",
        "Psalm 119:3",
        "Psalm 119:4",
        "Psalm 119:5",
        "Psalm 119:6",
        "Psalm 119:7",
        "Psalm 119:8",
        "Psalm 119:9",
        "Psalm 119:10",
        "Psalm 119:11",
        "Psalm 119:12",
        "Psalm 119:13"
      ],
      "semantic_role": null,
      "stem": null,
      "strong": "H4941",
      "surface": "לְֽ֭מִשְׁפָּטֶיךָ",
      "syntax_role": null,
      "token_id": "ps119.v091.t001",
      "transliteration": "lə",
      "word_sense": "your"
    },
    {
      "compiler_features": {
        "component_count": 1,
        "conjunction_role": null,
        "construct_state": false,
        "discourse_marker": null,
        "divine_name": false,
        "english_parts": [
          "stand"
        ],
        "gloss_fragments": [
          "they stand forth"
        ],
        "preposition_role": null,
        "raw_classes": [
          "verb"
        ],
        "raw_pos": [
          "verb"
        ],
        "suffix_pronoun": null,
        "temporal_pair_candidate": false
      },
      "corpus_occurrence_refs": [
        "Psalm 1:1",
        "Psalm 10:1",
        "Psalm 19:10",
        "Psalm 26:12",
        "Psalm 30:8",
        "Psalm 31:9",
        "Psalm 33:9",
        "Psalm 33:11",
        "Psalm 38:12",
        "Psalm 76:8",
        "Psalm 102:27",
        "Psalm 104:6",
        "Psalm 106:23",
        "Psalm 106:30",
        "Psalm 107:25",
        "Psalm 109:6",
        "Psalm 109:31",
        "Psalm 111:3",
        "Psalm 111:10",
        "Psalm 112:3",
        "Psalm 112:9",
        "Psalm 122:2",
        "Psalm 130:3",
        "Psalm 134:1"
      ],
      "display_gloss": "they stand forth",
      "enrichment_sources": {
        "macula": {
          "available_fields": [
            "syntax_role",
            "word_sense"
          ],
          "missing_fields": [
            "semantic_role",
            "referent"
          ],
          "status": "partial"
        },
        "oshb": {
          "available_fields": [
            "lemma",
            "strong",
            "morph_code",
            "morph_readable",
            "part_of_speech",
            "stem"
          ],
          "missing_fields": [],
          "status": "complete"
        }
      },
      "gloss_parts": [
        "they.stand.forth"
      ],
      "greek": "διαμένει",
      "greek_strong": "1265",
      "lemma": "עָמַד",
      "missing_enrichments": [
        "macula:semantic_role",
        "macula:referent"
      ],
      "morph_code": "Vqp3cp",
      "morph_readable": "Vqp3cp",
      "normalized": "עמדו",
      "occurrence_index": 24,
      "part_of_speech": "verb",
      "psalms_occurrence_refs": [
        "Psalm 1:1",
        "Psalm 10:1",
        "Psalm 19:10",
        "Psalm 26:12",
        "Psalm 30:8",
        "Psalm 31:9",
        "Psalm 33:9",
        "Psalm 33:11",
        "Psalm 38:12",
        "Psalm 76:8",
        "Psalm 102:27",
        "Psalm 104:6",
        "Psalm 106:23",
        "Psalm 106:30",
        "Psalm 107:25",
        "Psalm 109:6",
        "Psalm 109:31",
        "Psalm 111:3",
        "Psalm 111:10",
        "Psalm 112:3",
        "Psalm 112:9",
        "Psalm 122:2",
        "Psalm 130:3",
        "Psalm 134:1"
      ],
      "ref": "Psalm 119:91#2",
      "referent": null,
      "same_psalm_occurrence_refs": [
        "Psalm 119:90"
      ],
      "semantic_role": null,
      "stem": "qal",
      "strong": "H5975",
      "surface": "עָמְד֣וּ",
      "syntax_role": "v",
      "token_id": "ps119.v091.t002",
      "transliteration": "ʿāməḏû",
      "word_sense": "they.stand.forth"
    },
    {
      "compiler_features": {
        "component_count": 2,
        "conjunction_role": null,
        "construct_state": false,
        "discourse_marker": null,
        "divine_name": false,
        "english_parts": [
          "this",
          "day"
        ],
        "gloss_fragments": [
          "this",
          "day"
        ],
        "preposition_role": null,
        "raw_classes": [
          "art",
          "noun"
        ],
        "raw_pos": [
          "particle",
          "noun"
        ],
        "suffix_pronoun": null,
        "temporal_pair_candidate": true
      },
      "corpus_occurrence_refs": [
        "Psalm 2:7",
        "Psalm 7:12",
        "Psalm 18:1",
        "Psalm 18:19",
        "Psalm 19:3",
        "Psalm 20:2",
        "Psalm 20:10",
        "Psalm 21:5",
        "Psalm 23:6",
        "Psalm 25:5",
        "Psalm 27:4",
        "Psalm 27:5",
        "Psalm 32:3",
        "Psalm 34:13",
        "Psalm 35:28",
        "Psalm 37:18",
        "Psalm 37:19",
        "Psalm 37:26",
        "Psalm 38:7",
        "Psalm 38:13",
        "Psalm 41:2",
        "Psalm 42:4",
        "Psalm 42:11",
        "Psalm 44:2"
      ],
      "display_gloss": "day this",
      "enrichment_sources": {
        "macula": {
          "available_fields": [
            "word_sense"
          ],
          "missing_fields": [
            "syntax_role",
            "semantic_role",
            "referent"
          ],
          "status": "partial"
        },
        "oshb": {
          "available_fields": [
            "lemma",
            "strong",
            "morph_code",
            "morph_readable",
            "part_of_speech"
          ],
          "missing_fields": [
            "stem"
          ],
          "status": "partial"
        }
      },
      "gloss_parts": [
        "this",
        "day"
      ],
      "greek": "ἡ ἡμέρα",
      "greek_strong": "2250",
      "lemma": "יוֹם",
      "missing_enrichments": [
        "oshb:stem",
        "macula:syntax_role",
        "macula:semantic_role",
        "macula:referent"
      ],
      "morph_code": "Td/Ncmsa",
      "morph_readable": "Td/Ncmsa",
      "normalized": "היום",
      "occurrence_index": 84,
      "part_of_speech": "noun",
      "psalms_occurrence_refs": [
        "Psalm 2:7",
        "Psalm 7:12",
        "Psalm 18:1",
        "Psalm 18:19",
        "Psalm 19:3",
        "Psalm 20:2",
        "Psalm 20:10",
        "Psalm 21:5",